{
    "$id": "https://moos.factory/schemas/instance.schema.json",
    "$schema": "http://json-schema.org/draft-07/schema#",
    "title": "Mo:os Instance Schema",
    "description": "Validates instances/*.json files. Requires domain and entries[]. Each entry must have id (URN) and type_id (from ontology enum). stratum is optional; when present must be S0-S4 and within allowed_strata for the type_id per ontology.json.",
    "type": "object",
    "required": [
        "domain",
        "entries"
    ],
    "properties": {
        "$schema": {
            "type": "string"
        },
        "schema_version": {
            "type": "string"
        },
        "domain": {
            "type": "string",
            "minLength": 1
        },
        "role": {
            "type": "string",
            "description": "Instance role (e.g. value-layer, selection-layer)"
        },
        "canonicality": {
            "type": "string",
            "enum": ["canonical-structural", "canonical-contingent", "contingent"],
            "description": "How authoritative this instance file is"
        },
        "description": {
            "type": "string"
        },
        "entries": {
            "type": "array",
            "minItems": 1,
            "items": {
                "type": "object",
                "required": [
                    "id",
                    "type_id"
                ],
                "properties": {
                    "id": {
                        "type": "string",
                        "pattern": "^urn:moos:",
                        "description": "Canonical URN for this instance, e.g. urn:moos:provider:anthropic"
                    },
                    "type_id": {
                        "type": "string",
                        "description": "Foreign key to ontology.json objects[].type_id — must be one of the 21 canonical values",
                        "enum": [
                            "user",
                            "collider_admin",
                            "superadmin",
                            "app_template",
                            "node_container",
                            "agnostic_model",
                            "system_tool",
                            "ui_lens",
                            "runtime_surface",
                            "compute_resource",
                            "protocol_adapter",
                            "infra_service",
                            "memory_store",
                            "platform_config",
                            "workstation_config",
                            "preference",
                            "provider",
                            "benchmark_suite",
                            "benchmark_task",
                            "benchmark_score",
                            "agent_spec"
                        ]
                    },
                    "stratum": {
                        "type": "string",
                        "enum": [
                            "S0",
                            "S1",
                            "S2",
                            "S3",
                            "S4"
                        ],
                        "description": "Optional stratum hint. When present must be within allowed_strata for this type_id per ontology.json."
                    },
                    "name": {
                        "type": "string"
                    },
                    "description": {
                        "type": "string"
                    },
                    "status": {
                        "type": "string"
                    },
                    "industry_source": {
                        "type": "string",
                        "pattern": "^urn:moos:source:",
                        "description": "Optional URN tracing this instance back to its industry source (from sources.json)"
                    },
                    "industry_ref": {
                        "type": "string",
                        "description": "Optional ID of the industry entry this instance was selected from"
                    }
                },
                "additionalProperties": true
            }
        }
    },
    "additionalProperties": true
}