{
  "$schema": "../superset/schemas/instance.schema.json",
  "schema_version": "3.0",
  "domain": "distribution",
  "role": "value-layer",
  "canonicality": "canonical-contingent",
  "entries": [
    {
      "id": "urn:moos:distribution:platform_distribution",
      "type_id": "platform_config",
      "workspace_root": "D:/FFS0_Factory/moos",
      "active_platform_root": "platform/kernel/",
      "kernel_module": "platform/kernel",
      "windows_local_dev": {
        "default_store": "file",
        "log_path": "./platform/kernel/data/morphism-log.jsonl",
        "registry_path": "../.agent/kb/superset/ontology.json",
        "database_mode": "optional; only required when MOOS_KERNEL_STORE=postgres"
      },
      "demo_seed": {
        "payload": "platform/kernel/examples/explorer-demo.materialize.json",
        "apply_endpoint": "/hydration/materialize"
      }
    }
  ]
}