{
    "$schema": "../superset/schemas/instance.schema.json",
    "schema_version": "3.0",
    "domain": "agents",
    "role": "value-layer",
    "canonicality": "canonical-contingent",
    "description": "Agent specification instances — OBJ21 (AgentSpec) containers. Each agent binds a model, routes to tools, and syncs state. The configured persona that acts on behalf of a User.",
    "entries": [
        {
            "id": "urn:moos:agent:copilot-interim",
            "type_id": "agent_spec",
            "name": "Copilot Interim Agent",
            "description": "Default agent for local development. Uses Gemini 3.1 Pro as default model with fallback chain. Routes to active tools via CAN_ROUTE morphisms.",
            "model_binding": {
                "default_provider": "gemini",
                "default_model": "gemini-3.1-pro",
                "fallback_order": [
                    "gemini",
                    "anthropic",
                    "openai",
                    "ollama"
                ],
                "temperature": 0.7,
                "max_tokens": 4096,
                "config_source": "moos.yaml#agent_defaults"
            },
            "tool_routing": [
                "urn:moos:tool:category-master",
                "urn:moos:tool:mcp-integration-expert",
                "urn:moos:tool:golang-backend-development",
                "urn:moos:tool:rest-api-design-patterns",
                "urn:moos:tool:architecture-designer",
                "urn:moos:tool:code-reviewer",
                "urn:moos:tool:secure-code-guardian"
            ],
            "morphisms": {
                "source": [
                    "CAN_HYDRATE",
                    "CAN_ROUTE",
                    "SYNC_ACTIVE_STATE"
                ],
                "target": [
                    "OWNS"
                ]
            },
            "status": "active"
        },
        {
            "id": "urn:moos:agent:firestarter",
            "type_id": "agent_spec",
            "name": "Firestarter Agent",
            "description": "Graph growth accelerator — reads SKILL.md files, classifies against ontology, generates hydration programs. The morphism that makes the graph grow faster. Wired into the graph it grows.",
            "model_binding": {
                "default_provider": "anthropic",
                "default_model": "claude-opus-4-6",
                "config_source": "moos.yaml#agent_defaults"
            },
            "tool_routing": [
                "urn:moos:tool:category-master",
                "urn:moos:tool:spec-miner"
            ],
            "morphisms": {
                "source": [
                    "CAN_HYDRATE",
                    "CAN_ROUTE",
                    "SYNC_ACTIVE_STATE"
                ],
                "target": [
                    "OWNS"
                ]
            },
            "status": "active"
        }
    ]
}